"date","author","body","titles","urls"
"09/02/2021","Redacción elvocero.com","El agente Edwin Calderón Torres, de la División de Homicidios de Arecibo, informó que el joven David González León, de 25 años y residente en Hatillo, fue localizado anoche en el barrio Cortés, en Manatí.Según el informe, una ciudadana informó a la Policía que vio al joven saliendo de un área boscosa en la mencionada comunidad.Se indicó que González León se encontraba un poco desorientado y fue transportado a un hospital del área en condición estable.Personal de la Policía Municipal de Manatí y Barceloneta, Manejo de Emergencias y la Unidad Canina del Negociado de la Policía de Puerto Rico estuvo en la búsqueda el joven durante varios días.","Localizan a joven reportado desaparecido","/ley-y-orden/localizan-a-joven-reportado-desaparecido/article_7164d652-6ad6-11eb-bab1-af74426d434f.html"
"09/02/2021","InterNewsService","Un total de 1,152.17 dólares fueron sustraídos de una tarjeta de débito hurtada a un hombre fallecido en el Hospital San Francisco, según denunció a eso de las 6:00 de la tarde de ayer una de sus sobrinas.La querellante relató que alguien se apropió de una cartera tipo wallet perteneciente a su tío, quien falleció estando recluido en el hospital, ubicado en la calle De Diego, en Río Piedras.Agentes adscritos al precinto Río Piedras realizaron las pesquisas preliminares y luego refirieron los antecedentes a personal de la División de Delitos Contra la Propiedad del Cuerpo de Investigaciones Criminales de San Juan.","Se apropian de más de $1,000 de tarjeta de débito de hombre fallecido","/ley-y-orden/se-apropian-de-m-s-de-1-000-de-tarjeta-de-d-bito-de-hombre/article_9408fe70-6ad3-11eb-b2c8-bb4a4b4877c2.html"
"09/02/2021","Miguel Rivera Puig, EL VOCERO","BAYAMÓN – Varios enmascarados irrumpieron en la tarde de ayer, en una residencia en la urbanización Santa Juanita, donde agredieron al propietario para robarle dos pistolas Glock calibre 9mm, cuatro cargadores y 64 balas.El perjudicado, quien tiene licencia para portar las armas, les dijo a los agentes que estaba durmiendo cuando fue despertado por los asaltantes, todos encapuchados. Le dieron un fuerte golpe en la oreja derecha y en el rostro.Agentes de la División de Robos del Cuerpo de Investigaciones Criminales (CIC) de Bayamón tienen a su cargo la investigación.","Le llevan dos pistolas en robo domiciliario","/ley-y-orden/le-llevan-dos-pistolas-en-robo-domiciliario/article_cad82212-6ac6-11eb-930b-bb247066448a.html"
"Feb 9, 2021","Miguel Rivera Puig, EL VOCERO","Alrededor de 7,525 agentes y oficiales del Negociado de la Policía fueron vacunados contra el Covid-19 hasta la semana pasada y restan poco más de dos mil por vacunarse.Un número no determinado de agentes rechazó ser vacunado, ya que no es obligatorio.El comisionado Antonio López Figueroa realizó gestiones ayer con el doctor Carlos Mellado, secretario de Salud, al que procuró que para la semana entrante se logre vacunar a los poco más de dos mil agentes que faltan.La doctora María del Carmen Calderón, médico de la Policía, tiene a su cargo los protocolos para la vacunación.Siete miembros de la Uniformada han muerto por causa del coronavirus.","Vacunados más de 7,000 agentes de la Policía","/ley-y-orden/vacunados-m-s-de-7-000-agentes-de-la-polic-a/article_190c7164-6ac6-11eb-9aec-374068b3d16f.html"
"09/02/2021","Redacción elvocero.com","Un hombre resultó herido de bala a eso de las 8:29 p.m. de ayer, en el kilómetro 18.2 de la carretera PR-159, en Corozal.Según la Policía, el perjudicado, de 40 años, alegó que conducía por el lugar cuando otro vehículo lo rebasó y desde este, le realizaron varios disparos que lo alcanzaron en diferentes partes del cuerpo.El herido fue trasladado en condición estable a una institución hospitalaria de la región.Al momento, se desconoce el móvil de los hechos.Agentes adscritos a la División de Agresiones del Cuerpo de Investigaciones Criminales (CIC) de Vega Baja se hicieron cargo de la pesquisa.","Balean a hombre en Corozal","/ley-y-orden/balean-a-hombre-en-corozal/article_f848bfb6-6ac3-11eb-9a3e-eb89fa8f192c.html"
"una hora","Miguel Rivera Puig, EL VOCERO","Seis muertes violentas se registraron ayer y otras tres el viernes, entre ellas la de una niña de nueve meses de nacida golpeada brutalmente por su madre, sumando 86 los asesinatos desde que comenzó el año, un aumento de tres comparado con 2020.El último de los hechos del cruento fin de semana se escenificó a las 10:41 de la noche de ayer, frente al edificio 11 en el residencial Roosevelt, en Mayagüez.Sicarios ultimaron a balazos a Jan Carlos Rodríguez Rodríguez, de 26 años, con domicilio en la urbanización Riveras. La víctima tenía antecedentes penales por tentativa de asesinato, armas, drogas y resistencia al arresto.A las 9:44 de la noche de ayer, fue asesinado Jorge Luis Guerra Burgos, de 42 años, por pistoleros que lo acechaban en la PR-837 en el barrio Santa Rosa I, en Guaynabo. La víctima, con antecedentes de tentativa de asesinatos, armas, drogas y apropiación ilegal, salió de su casa en un Honda Accord modelo de 1997, y de inmediato fue mortalmente tiroteado.A la 1:49 de la tarde de ayer, ocurrió un doble asesinato en la PR-155 en la urbanización Alturas de Vega Baja. Los jóvenes Jean Carlos del Valle Arroyo, de 26 años, con antecedentes por armas, drogas y Ley Vehicular, y Justo Joered Pagán Pagán, de 22 años, con antecedentes por drogas, ambos vecinos de Alturas de Vega Baja, fueron mortalmente baleados cuando viajaban en un Honda Accord modelo de 2019.A las 8:26 de la mañana de ayer, fue hallado el cadáver baleado de José Montalvo Mártir en el interior de un Chrysler 300 estacionado cerca de una escuela en la PR-129, en el barrio Hato Arriba, en Arecibo. La víctima tenía antecedentes por armas, amenaza y violencia doméstica.A las 5:15 de la madrugada de ayer, y en medio de una balacera en el residencial Barbosa, en Bayamón, un joven de 18 años resultó muerto y otro de 28 años herido.Al llegar la Policía al lugar respondiendo al sistema de detección de disparos, las víctimas habían sido llevadas por vecinos a distintos hospitales.Jonathan Yamil Cruz Ramírez fue declarado muerto en un hospital privado. Según la Policía, ya había sido fichado como adulto por un caso de drogas.El herido fue atendido en un hospital en Bayamón.En los informes policiales, fue agregado como asesinato la muerte de la infanta Alondra Marie Irizarry Colón, ocurrido en la mañana del viernes en el residencial Rincón Taíno en Santa Isabel.Daisy Colón Torres, de 27 años, madre de la menor, fue acusada ayer de asesinato en primer grado y sumariada en una cárcel cuando no prestó la fianza de $800 mil que le fue señalada por una jueza en Ponce.","Se registran nueve asesinatos en el fin de semana","/ley-y-orden/se-registran-nueve-asesinatos-en-el-fin-de-semana/article_de3bf266-6eb8-11eb-a012-6b1df6ad74c7.html"
"14/02/2021","Associated Press","DUBÁI, Emiratos Árabes Unidos — Emiratos Árabes Unidos publicó hoy la primera imagen tomada por su sonda marciana, que está orbitando en torno al planeta rojo.La fotografía, tomada, el miércoles, muestra la luz del sol iluminando la superficie del planeta. Muestra el polo norte Marte, así como su volcán más grande, el Monte Olimpo.La imagen fue tomada por la sonda espacial Amal, o “Esperanza”.La nave entró el martes en la órbita marciana, un triunfo para la primera misión interplanetaria árabe.","Emiratos Árabes publica la primera foto de su misión a Marte","/el-mundo/emiratos-rabes-publica-la-primera-foto-de-su-misi-n-a-marte/article_075dcf7c-6eb7-11eb-869c-cb57c9059d81.html"
"14/02/2021","Mari Yamaguchi, Associated Press","JAPÓN — Las autoridades japonesas aprobaron hoy su primera vacuna contra el Covid-19 y dijeron que comenzarían las vacunaciones en cuestión de días, meses después de Estados Unidos y muchos otros países.El Ministerio japonés de Salud dijo que había aprobado la vacuna codesarrollada por Pfizer Inc. y BioNTech.El anuncio se produjo después de que un comité del gobierno confirmara que los resultados finales de los ensayos clínicos realizados en Japón mostraron que la vacuna tenía una eficacia similar a la registrada en los ensayos en el extranjero.Muchos países comenzaron a vacunar a sus ciudadanos a finales del año pasado, y la vacuna de Pfizer se ha utilizado en otros lugares desde diciembre.Según el plan actual, unos 20,000 trabajadores médicos de primera línea en hospitales de Japón serán los primeros en vacunarse a partir del miércoles, aproximadamente. Otros 3.7 millones de trabajadores médicos irán después, seguidos por ancianos que deberían recibir sus inyecciones a partir de abril. Se espera que la población general pueda optar a vacunarse a partir de junio.Las vacunas están consideradas como cruciales para celebrar los aplazados Juegos Olímpicos de Tokio este verano. Se espera que Japón reciba 144 millones de dosis de Pfizer, 120 millones de AstraZeneca y unos 50 millones de Moderna antes de final de año, suficiente para cubrir a su población.Las vacunas desarrolladas en Japón están aún en las primeras fases de desarrollo, de modo que el país debe recurrir a importaciones. AstraZeneca pidió hace poco la aprobación de su fármaco en Japón, mientras que Moderna no lo ha hecho aún. La dependencia de Japón a las importaciones, muchas de ellas sujetas a los controles de exportación de la UE, también ha causado preocupación sobre el suministro.","Japón aprueba su primera vacuna contra el Covid-19","/el-mundo/jap-n-aprueba-su-primera-vacuna-contra-el-covid-19/article_29986bf2-6eb6-11eb-9ff9-9fc855aca1d0.html"
"una hora","Redacción elvocero.com","El Departamento de Salud reportó hoy en su informe 216 pacientes hospitalizados por Covid-19, un aumento de tres en comparación a la cifra informada ayer.Según la agencia, de las 216 personas hospitalizadas, hay 50 pacientes adultos en cuidados intensivos y 46 con ventilador.El número de hospitalizados por el virus se ha mantenido por debajo de los 300 —excepto el 3 de febrero— por las pasadas tres semanas.

Al momento, el País cuenta con 2,850 camas para adultos, 177 camas de intensivo y 795 ventiladores, así como 848 camas pediátricas, 64 camas de intensivo y 135 ventiladores pediátricos.
                        
                
                    
                
                
                
                
        
                        
                
            
            
        
                    
                
                
            
                
                
                    Gobierno
                
            
            
        
             
        

        
            Salud reporta cinco muertes y 920 casos adicionales de Covid-19
            Redacción elvocero.com
                
                    
                    
                    
                    
                    
                    
                    
                    
                
            
            
        Salud reportó hoy 930 casos entre confirmados y sospechosos.Con esto, la cifra acumulada asciende a 172,797 casos y a 1,919 muertes, entre confirmadas y probables, desde que comenzó la pandemia.","En 216 las hospitalizaciones por Covid-19","/gobierno/en-216-las-hospitalizaciones-por-covid-19/article_48983840-6eb4-11eb-a23d-171a9819d125.html"
"14/02/2021","Associated Press","NUEVA YORK — Un hombre no identificado podría ser el responsable de cuatro apuñalamientos distintos registrados en el espacio de unas horas en el metro de la ciudad de Nueva York, y que dejaron dos muertos, indicaron las autoridades.Los ataques ocurrieron entre el viernes por la mañana y ayer de madrugada, según indicó la Policía de Nueva York en una conferencia de prensa.Las cuatro víctimas eran personas sin hogar, según las autoridades.La policía buscaba a un hombre sospechoso de todas las agresiones, y revisaba las imágenes de las cámaras de seguridad. Los cuatro apuñalamientos ocurrieron en la línea A de metro.Una de las víctimas apareció muerta en un tren en Queens en torno a la medianoche del viernes, con múltiples heridas de arma blanca en el cuello y el torso. Dos horas más tarde se encontró a una mujer de 44 años asesinada a puñaladas en el metro en el norte de Manhattan.Los dos ataques no mortales, que afectaron a un hombre de 67 años y a otro de 43 años, también fueron en el norte de la isla.La policía de la ciudad dijo que desplegaría 500 agentes adicionales en la red de metro de toda la ciudad como medida de precaución.“A las víctimas, a las familias de las víctimas: estamos comprometidos al 100% en conseguir justicia (...) para dar a las familias una resolución de este terrible incidente”, dijo el comisario de la policía, Dermot Shea, en una conferencia de prensa.","Dos muertos y dos heridos en apuñalamientos en Nueva York","/el-mundo/dos-muertos-y-dos-heridos-en-apu-alamientos-en-nueva-york/article_498b7dc2-6eb2-11eb-907f-3376113e9822.html"
