"date","author","body","titles","urls"
"14/02/2021","InterNewsService","La estación de radio Magic (97.3 FM y 99.5 FM), presidida y dirigida por Joshua Arzuaga, anunció esta mañana que busca a estudiantes de Comunicación Pública en la isla para apadrinarlos en su carrera profesional.“Tenemos un compromiso inquebrantable y muy serio con el pueblo de Puerto Rico. Nuestra misión, con este novel proyecto, es servirles como una plataforma sólida a los nuevos profesionales del campo de las comunicaciones, que están saliendo de las distintas universidades y que desean abrirse paso en un mundo tan competitivo como éste”, manifestó Arzuaga.Añadió que “las universidades del país tienen una función muy importante en la formación de los estudiantes. Pero la realidad es que la práctica es la que hace la perfección. Esto es lo que pretendemos: pulirlos hasta convertirlos en diamantes”.Arzuaga adelantó que, como parte de la evolución de la empresa radial, producto de la gran aceptación con la que cuenta Magic en todos los demográficos “seguiremos ampliando nuestra plataforma de servicios, con la construcción de un atractivo estudio de televisión para la creación de contenido para nuestro canal de YouTube y Redes Sociales”.“Queremos retribuirle a Puerto Rico todo el amor y apoyo que nos brinda día tras día. Estamos en busca de estudiantes de comunicaciones para apadrinarlos y, asimismo, para que formen parte de nuestro canal de televisión”, informó.La convocatoria es para seleccionar a tres estudiantes de comunicaciones en las áreas de camarógrafo, editor y asistente de producción.Los interesados deben enviar su información al e-mail info@magic973.com . También pueden enviar un ‘demo’ o trabajo ya realizado.“Los interesados deben ser, además, creativos y decirnos por qué deben ser los estudiantes seleccionados y merecedores de construir, junto a nosotros, más momentos mágicos”, terminó Arzuaga.","Magic busca a estudiantes de comunicaciones","/actualidad/magic-busca-a-estudiantes-de-comunicaciones/article_22ad6222-6f04-11eb-b334-8feb7c0e4283.html"
"14/02/2021","InterNewsService","El cadáver de una mujer en estado de descomposición fue hallado esta mañana por una amiga en una residencia ubicada en la calle Euro de la urbanización Campanilla, en Toa Baja.El cuerpo de Carol Báez Santana fue localizado en su residencia e identificado por su hija.El policía municipal Ángel Rodríguez investigó preliminarmente, quien luego dejó el caso en manos del agente Nicolás Maldonado, de Homicidios del Cuerpo de Investigaciones Criminales de Bayamón y el fiscal Josué Padilla, quien ordenó el envío del cuerpo al Negociado de Ciencias Forenses para que a través de la autopsia se determinen las causas del deceso.","Hallan cadáver de una mujer en estado de descomposición en Toa Baja","/ley-y-orden/hallan-cad-ver-de-una-mujer-en-estado-de-descomposici-n-en-toa-baja/article_234d2d42-6f00-11eb-b97a-43624edd5a94.html"
"14/02/2021","InterNewsService","El cadáver de una mujer en estado de descomposición fue hallado esta mañana por una amiga en una residencia ubicada en la calle Euro de la urbanización Campanilla, en Toa Baja.El cuerpo de Carol Báez Santana fue localizado en su residencia e identificado por su hija.El policía municipal Ángel Rodríguez investigó preliminarmente, quien luego dejó el caso en manos del agente Nicolás Maldonado, de Homicidios del Cuerpo de Investigaciones Criminales de Bayamón y el fiscal Josué Padilla, quien ordenó el envío del cuerpo al Negociado de Ciencias Forenses para que a través de la autopsia se determinen las causas del deceso.","Hallan cadáver de una mujer en estado de descomposición en Toa Baja","/ley-y-orden/hallan-cad-ver-de-una-mujer-en-estado-de-descomposici-n-en-toa-baja/article_234d2d42-6f00-11eb-b97a-43624edd5a94.html"
"14/02/2021","InterNewsService","El cadáver de una mujer en estado de descomposición fue hallado esta mañana por una amiga en una residencia ubicada en la calle Euro de la urbanización Campanilla, en Toa Baja.El cuerpo de Carol Báez Santana fue localizado en su residencia e identificado por su hija.El policía municipal Ángel Rodríguez investigó preliminarmente, quien luego dejó el caso en manos del agente Nicolás Maldonado, de Homicidios del Cuerpo de Investigaciones Criminales de Bayamón y el fiscal Josué Padilla, quien ordenó el envío del cuerpo al Negociado de Ciencias Forenses para que a través de la autopsia se determinen las causas del deceso.","Hallan cadáver de una mujer en estado de descomposición en Toa Baja","/ley-y-orden/hallan-cad-ver-de-una-mujer-en-estado-de-descomposici-n-en-toa-baja/article_234d2d42-6f00-11eb-b97a-43624edd5a94.html"
"14/02/2021","InterNewsService","Un conductor de 46 años falleció y los ocupantes de otro vehículo quedaron en riesgo vital en medio de un accidente de tránsito ocurrido a las 5:07 de la tarde de ayer, en el kilómetro 4.3 de la carretera PR-357, en Maricao.Según el reporte del agente Guilloty, de Patrullas de Carreteras de Mayagüez, el accidente se produjo cuando Liceles Martínez Ronda, de 41 años, conducía a exceso de velocidad un Mercedes Benz negro, con tablilla DFG-249, en compañía de la joven Marlene Rivera Mercado, de 18 años, y al rebasar por la izquierda impactó de frente a un Suzuki Vitara negro, tablilla GDP-859, conducido por Jorge Williams Morales Rosado, quien falleció en el acto.Los ocupantes del Mercedes Benz fueron llevados en condición crítica al Centro Médico de Mayagüez.","Un muerto y dos heridos graves deja accidente de tránsito en Maricao","/ley-y-orden/un-muerto-y-dos-heridos-graves-deja-accidente-de-tr-nsito-en-maricao/article_04363814-6ef5-11eb-a2c7-a37a23bf4548.html"
"14/02/2021","InterNewsService","En la Cárcel Regional de Bayamón quedaron confinados dos de los tres arrestados la noche del viernes tras una persecución a pie por el interior del residencial Agustín Ruiz Miranda, en Hatillo.Durante una ronda preventiva, la Policía se percató de un Toyota Tercel que figuraba como hurtado con varios individuos a su alrededor, uno de ellos con un arma. Al identificarse como policías, los sujetos salieron corriendo y uno les realiza varios disparos, sin dar en el blanco.Finalmente se logró el arresto de José E. Díaz Rivera, de 19 años, Carlos D. Álvarez Vélez, de 25, y Ángel J. Ruiz Soto, de 25.Se les incautaron seis bolsas de marihuana, cuatro bolsas de crack, 54 decks de heroína, una pistola Glock 26 calibre 9mm, 14 municiones, un Toyota Tercel verde, tablilla IPC-002, que figuraba como hurtado, dos radios de comunicación y 839 dólares en efectivo.El agente Ricardo Ramos Pérez, de la División Drogas de Arecibo, y la fiscal Yolanda Pitino Acevedo, presentaron cargos por violación a la ley de armas, sustancias controladas y disparar contra un policía contra Ruiz Soto y contra Álvarez Vélez. La Fiscalía desestimó cargos contra Díaz Rivera.El caso fue llevado ante la jueza Michelle Camacho, del Tribunal de Primera Instancia de Arecibo, quien determinó causa para arresto y les fijó fianzas de un $1,100,000 a cada uno, que no fueron cubiertas.","Encarcelan a imputados de disparar contra policías en Hatillo","/ley-y-orden/encarcelan-a-imputados-de-disparar-contra-polic-as-en-hatillo/article_be6a3fe0-6eec-11eb-bf04-839ae98e697e.html"
"14/02/2021","InterNewsService","Un botín de 8,400 dólares en efectivo se llevó un delincuente que rompió el cristal de un vehículo estacionado en la marginal San Agustín de la avenida 65 de Infantería, en Río Piedras.Según denunció el querellante, a las 11:39 de la mañana de ayer, alguien tuvo acceso a su Hyundai Elantra gris de 2015 y se apropió de un sobre blanco que contenía el dinero.Asumieron las pesquisas agentes de la División de Delitos Contra la Propiedad del Cuerpo de Investigaciones Criminales (CIC) de San Juan.","Se llevan un sobre con $8,400 de auto estacionado en Río Piedras","/ley-y-orden/se-llevan-un-sobre-con-8-400-de-auto-estacionado-en-r-o-piedras/article_b3e2c718-6ee2-11eb-b193-7bdcd6869904.html"
"14/02/2021","Redacción elvocero.com","Un accidente de carácter fatal se reportó a eso de las 2:00 a.m. de hoy en el kilómetro 23.9 del expreso PR-22, en Dorado.Según la información preliminar, Jochie Méndez Torres, de 23 años, conducía un Nissan Sentra color gris de 2018 en dirección de Dorado hacia Bayamón y al llegar al referido tramo, perdió el control y dominio del volante, impactando una Suzuki Vitara color gris, que se encontraba en el paseo y en el interior el conductor identificado como Rafy González Domínguez, de 22 años, y Ángel Yomar Cortés Reyes, de 23 años, quien viajaba como pasajero.Debido al impacto, Cortés Reyes resultó con heridas graves, por lo que fue transportado en ambulancia hasta el Centro Médico de Río Piedras, donde posteriormente falleció.Méndez Torres y González Domínguez fueron trasportados al Doctors' Center Hospital, en Bayamón, en condición estable.El agente Carlos López, adscrito a la División de Autopistas de Buchanan, se hizo cargo de la investigación junto a la fiscal Laura Arill.","Joven pierde la vida en accidente en Dorado","/ley-y-orden/joven-pierde-la-vida-en-accidente-en-dorado/article_2043d5f0-6ecf-11eb-bc03-8b691892d0f6.html"
"6 horas","Miguel Rivera Puig, EL VOCERO","CABO ROJO – El cadáver con múltiples heridas de bala de un hombre fue hallado a eso de las 7:30 de la mañana de hoy, a orillas de la carretera PR-102 en el barrio Guanajibo, mientras los agentes del Cuerpo de Investigaciones Criminales (CIC) de Mayagüez investigan una balacera en el barrio Maní que dejó a un individuo herido.Con esta muerte suman 10 los asesinatos del fin de semana y 87 los ocurridos desde que comenzó el año, un aumento de cuatro comparado con 2020.El área policíaca de Mayagüez suma nueve asesinatos, un aumento de seis comparado con el pasado año.Anoche un individuo fue asesinado en el residencial Roosevelt en Mayagüez.","Muerte violenta en Cabo Rojo","/ley-y-orden/muerte-violenta-en-cabo-rojo/article_101f044a-6ec7-11eb-b9ee-97166a530af7.html"
"14/02/2021","Miguel Rivera Puig, EL VOCERO","Una mujer de 38 años acudió ayer a un hospital en el área metropolitana, tras haber sido secuestrada por un sátiro armado que la agredió sexualmente, sumando 23 los casos de violaciones desde que comenzó 2021, un aumento de seis comparado con 2020.La víctima se encontraba en la intersección de la PR-181 y la avenida De Diego, en Río Piedras, cuando el individuo en un vehículo color negro le apuntó con un arma de fuego.La obligó a abordar el automóvil y la llevó a un lugar cercano, donde cometió la fechoría. El agresor sexual fue descrito como de tez trigueña, cuerpo ancho, de unos 30 años y con voz ""finita"".De las 23 violaciones que figuran en las estadísticas, siete han ocurrido en la ciudad capital, un aumento de cinco comparado con 2020.Agentes de la División de Delitos Sexuales del Cuerpo de Investigaciones Criminales (CIC) de San Juan se hicieron cargo de la investigación.","Mujer denuncia secuestro y agresión sexual","/ley-y-orden/mujer-denuncia-secuestro-y-agresi-n-sexual/article_d8b6a906-6ebf-11eb-b6d1-ff8de993ddf8.html"
"14/02/2021","Redacción elvocero.com","La celebración del Día de la Amistad se convirtió en una peculiar caravana, en la que más de 50 estudiantes de la Bayamón Military Academy visitaron seis cuarteles para reconocer a los policías de Puerto Rico.El evento sirvió como antesala a la conmemoración de la Semana de los Policías, a celebrarse del 21 al 27 de febrero de 2021.Los estudiantes llevaron obsequios y entregaron placas de reconocimiento como muestra de agradecimiento y admiración por su labor policial. Durante las paradas, los profesionales pudieron compartir con los estudiantes sus diferentes roles en velar por la seguridad de los ciudadanos, reducir la incidencia criminal y la violación de las leyes para mantener el orden y la paz en el País.
                       
                   
            
            
                
                
                
                
        
            
                
                
            
            
                
                
                    
                                Suministrada
                            
                        
                        
                    “En la Bayamón Military Academy estamos enfocados en proveerle a nuestros estudiantes todas las herramientas que están a nuestro alcance para que tengan un desarrollo sano en un ambiente seguro. La labor de los policías de Puerto Rico es un gran ejemplo para nuestros estudiantes, que está alineada a nuestra visión. Nuestros jóvenes necesitan ejemplos de profesionales que tuvieron una formación que promovemos y respetamos en nuestra academia. Reconocemos su gran compromiso con las comunidades de nuestra Isla y quisimos llevarle un poco de alegría y agradecimiento”, expresó Joana Torres, maestra de la academia.
                       
                   
            
            
                
                
                
                
        
            
                
                
            
            
                
                
                    
                                Suministrada 
                            
                        
                        
                    La caravana visitó seis cuarteles en el municipio de Bayamón, finalizando con una parada especial en el Cuartel General en San Juan. Los policías recibieron a los estudiantes con gran emoción y sorprendidos por su visita.Bayamón Military Academy provee una educación que desarrolla las capacidades, habilidades y cualidades de liderazgo para los estudiantes, desde pre-kínder hasta duodécimo grado, basado en un enfoque militar. Para más información puede comunicarse al 787-798-6510.","Caravana de la amistad en honor a policías","/ley-y-orden/caravana-de-la-amistad-en-honor-a-polic-as/article_adae238a-6eae-11eb-9249-0b0b5cf770fb.html"
"13/02/2021","Redacción elvocero.com","El Agente Especial a Cargo de la Oficina de San Juan del Negociado Federal de Investigación (FBI, por sus siglas en inglés), Rafael A. Riviere Vázquez, anunció el arresto de Carlos A. Ortiz Santiago (Ortiz Santiago).Ortiz Santiago fue acusado mediante querella por violaciones al Título 18, Código de los Estados Unidos, United States Code, Seciones 2119 (Carjacking) 924(c) (Uso de un arma de fuego durante la comisión de un crimen violento) por eventos que ocurrieron en San Juan, Puerto Rico en diciembre del 2020.El sujeto fue arrestado por Agentes Especiales de la Escuadra de Crímenes Violentos de la Oficina de San Juan del FBI. El arresto se llevó a cabo el 10 de febrero de 2021 luego de que Ortiz Santiago fuera detenido por Agentes de la Policía de Puerto Rico.El enjuiciamiento de este caso está a cargo del Fiscal Federal Johathan Gottfried, de la Sección de Crímenes Violentos y es investigado por la Oficina de San Juan del FBI.Las confidencias e información ayudan al FBI y a sus colegas federales, estatales y locales en el desempeño de sus funciones. Por ello, se le solicita al público que contacte a la Oficina de San Juan del FBI al 787-987-6500, o reporte confidencias a través de la línea de pistas (tips) del FBI, disponible en la página de internet Tips.FBI.Gov.Los querellantes podrán permanecer anónimos.Se le recuerda al público que una Querella sólo contiene cargos y no es evidencia de culpabilidad. Todo acusado se presume inocente hasta que se pruebe lo contrario más allá de toda duda razonable. El Gobierno de los Estados Unidos tiene el peso de la prueba.","FBI arresta a hombre por carjacking y uso de arma de fuego","/ley-y-orden/fbi-arresta-a-hombre-por-carjacking-y-uso-de-arma-de-fuego/article_7043a66a-6e53-11eb-83c5-5b2de16fed01.html"
"13/02/2021","Redacción elvocero.com","La juez Annette Marie Santiago Díaz del Tribunal de Primera Instancia de Ponce determinó causa probable para arresto por el asesinato de una menor de unos 9 meses de nacida, contra Daisy Marie Colón Torres de 27 años, por hechos ocurridos el 12 de febrero de 2021 en Santa Isabel. Así lo dieron a conocer el secretario de justicia Domingo Emanuelli Hernández, la jefa de los fiscales Melissa Vázquez Sandoval y la fiscal de distrito de Ponce Marjorie Gierbolini La investigación del caso fue llevada por la fiscal Tasha Cruz Rodríguez en coordinación con el agente José I. Torres Cruz de la División de Homicidios del CIC de Ponce. La imputada Colón Torres llevó a su hija de 9 meses al centro de urgencias de Santa Isabel, al ser atendida por el médico de turno, éste certificó ausencia de signos vitales. La menor presentaba múltiples hematomas en diferentes partes del cuerpo, incluyendo la cara.  De la investigación se desprende que la menor fue sometida a un patrón de maltrato lo que le ocasionó la muerte. A la imputado Colón Torres se le radicó un cargo por el Artículo 93 Asesinato del Código Penal de Puerto Rico. La juez Santiago Díaz fijó una fianza de $800,000 la cual no fue prestada, siendo ingresada a la cárcel.   La vista preliminar fue señalada para el 3 de marzo de 2021.   # # #","Fiscalía de Ponce presenta cargos contra mujer por asesinato de bebé","/ley-y-orden/fiscal-a-de-ponce-presenta-cargos-contra-mujer-por-asesinato-de-beb/article_01d87cbe-6e44-11eb-a289-47f4e96aaf78.html"
"13/02/2021","InterNewsService","Agentes de la división Drogas de Yauco incautaron anoche un vehículo en cuyo interior fueron encontradas más de 770 dosis de sustancias controladas, dinero en efectivo y municiones, hechos registrados en la calle Del Río del barrio Quebrada, en Guayanilla.Al interior de un Toyota C-HR blanco del año 2021 fueron halladas 714 bolsitas de crack, 61 pastillas, un cargador con 19 municiones calibre .40 y 1,249 dólares en efectivo.No hubo arrestos relacionados con el caso.","Incautan más de 700 bolsitas de crack en Guayanilla","/ley-y-orden/incautan-m-s-de-700-bolsitas-de-crack-en-guayanilla/article_85559a52-6e41-11eb-9b13-1309ff82e132.html"
"Feb 13, 2021","Redacción elvocero.com","Un doble asesinato se reportó a la 1:49 de la tarde de hoy en la carretera 155 frente a la panadería que ubica en la urbanización Alturas de Vega Baja en Vega Baja. De acuerdo a la información preliminar, una llamada a través del sistema de emergencias 9-1-1 alerto a las autoridades sobre los hechos, al llegar al lugar encontraron un vehículo Honda Accord color gris con múltiples impactos de bala y en el interior dos cuerpos con heridas de bala.  Agentes adscritos al Distrito de Vega Baja junto agentes de la División de Homicidios del Cuerpo de investigaciones Criminales de Vega Baja se encuentran en el lugar investigando.","Se reporta doble asesinato en Vega Baja","/ley-y-orden/se-reporta-doble-asesinato-en-vega-baja/article_d3fa10aa-6e39-11eb-a231-6f327d34f628.html"
"Feb 13, 2021","InterNewsService","Un cajero automático valorado en 4,460 dólares se llevaron varios delincuentes durante un asalto perpetrado a las 2:34 de la madrugada de hoy en el garaje Total ubicado en la carretera 4491, sector Las Alcantarillas del barrio Puente, en Camuy.Según informó el querellante, Pablo Cordero, los individuos llegaron en un vehículo tipo van de color oscuro y cargaron un cajero automático ATM gris marca Hyosun de la compañía Easy Cash.El agente William Padín Jiménez, del distrito de Camuy, investigó preliminarmente, y luego refirió el caso a personal de la división de Delitos Contra la Propiedad del CIC de Arecibo.","Roban cajero automático de gasolinera en Camuy","/ley-y-orden/roban-cajero-autom-tico-de-gasolinera-en-camuy/article_b44d72c4-6e2a-11eb-a0eb-f794c239caa0.html"
"13/02/2021","InterNewsService","Un hombre que no ha sido identificado fue hallado muerto a las 7:50 de la mañana de hoy en su habitación del hotel La Concha, en Condado, sin signos evidentes de violencia.Una llamada al Sistema de Emergencias 911 dio cuenta de la situación, que fue investigada por agentes del precinto de Calle Loíza.El caso quedó en manos de personal de Homicidios del Cuerpo de Investigaciones Criminales (CIC) de San Juan.","Encuentran sin vida a hombre en hotel de Condado","/ley-y-orden/encuentran-sin-vida-a-hombre-en-hotel-de-condado/article_949a9f08-6e23-11eb-b739-afa71f944763.html"
"13/02/2021","InterNewsService","La Policía de Mayagüez arrestó a las 2:35 de la tarde del viernes a un oficial de Corrección y a una maestra del Departamento de Educación en medio de un allanamiento antidrogas ejecutado en el 31 de la calle Archilla Cabrera de la urbanización Hostos, en Mayagüez.En el lugar fueron arrestados Gerardo Hommy Pérez Valentín, de 47 años y oficial de la Institución Juvenil de Ponce, y a su pareja, Annette Michelle Rivera Orlandi, de 42 años.En el lugar se incautaron 62.9 gramos de cocaína, 89 pastillas controladas, parafernalia, dos manoplas y 2,690 dólares en efectivo. Además, se confiscaron tres pistolas Beretta. Una modelo 92FS, calibre 9mm, dos cargadores y 86 municiones de ese calibre otra modelo Gardone VT, calibre 380, con tres cargadores y 37 municiones y una 950BS, calibre .25, tres cargadores y 16 municiones del mismo calibre.Pérez Valentín posee licencia de tiro al blanco que expira el 20 de diciembre de 2022.Se consultó con la fiscal Odemarys De Jesús, de la Fiscalía de Mayagüez, quien citó el caso para el 18 de febrero para la presentación de cargos.Se le dio conocimiento a oficiales de alto rango del Departamento de Corrección y Rehabilitación, que procedió a iniciar una investigación interna y administrativa.","Arrestan a oficial de Corrección y a maestra por trasiego de drogas y posesión de armas","/ley-y-orden/arrestan-a-oficial-de-correcci-n-y-a-maestra-por-trasiego-de-drogas-y-posesi/article_24d374b2-6e12-11eb-a248-078496472b40.html"
"Feb 13, 2021","InterNewsService","Un individuo de 27 años fue ultimado a tiros a las 10:22 de anoche en la parte posterior del kiosco número 60, en Luquillo.Una llamada al 911 alertó sobre una persona herida de bala, y al llegar las autoridades encontraron el cuerpo baleado de Lester González Carrasquillo, de 27 años y vecino de Río Grande, quien presentaba múltiples impactos de bala.El perjudicado fue llevado al hospital HIMA San Pablo, en Fajardo, donde el médico de turno solo pudo certificar su muerte.Asumieron las pesquisas agentes de Homicidios del Cuerpo de Investigaciones Criminales de Fajardo.","Asesinan a hombre en los kioscos de Luquillo","/ley-y-orden/asesinan-a-hombre-en-los-kioscos-de-luquillo/article_678191c8-6e0c-11eb-adac-0f18920368b7.html"
"Feb 13, 2021","InterNewsService","Las autoridades policiales investigan la muerte de un hombre reportada en la mañana de hoy a través del sistema de emergencias 9-1-1, en la carretera PR-129 en el barrio Hoto Arroba, en Arecibo.Según se informó que al lugar se personaron los agentes del Precinto 107 de Arecibo, donde se localizó un vehículo color blanco de cuatro puertas y en cuyo interior se hallaba el cuerpo de un hombre, el cual presenta heridas de bala.No ha sido identificado por el momento y se desconocen más datos de lo ocurrido.","Asesinan a tiros a hombre dentro de vehículo en Arecibo","/ley-y-orden/asesinan-a-tiros-a-hombre-dentro-de-veh-culo-en-arecibo/article_bef092e2-6e07-11eb-a45d-e333562f3a68.html"
"Feb 12, 2021","Redacción elvocero.com","Un escalamiento fue reportado el día de ayer en una residencia que ubica en la carretera 156 Barrio Sabana en el pueblo de Orocovis.Se forzó la ventana de madera de una estructura anexa a la residencia, para tener acceso al interior de donde se apropiaron ilegalmente de tres cockatiel, dos cotorras quaker, 30 pericos y 22 love birds. La propiedad fue valorada aproximadamente en $1,790 dólares.Fue referido a la División de Propiedad del Cuerpo de Investigaciones Criminales de Aibonito para que se haga cargo de la investigación correspondiente.","Roban aves de residencia en Orocovis","/ley-y-orden/roban-aves-de-residencia-en-orocovis/article_d15b2e1a-6d4e-11eb-8f74-1b3e2d0c1f4e.html"
"Feb 12, 2021","InterNewsService","Una infanta de nueve meses fue llevada sin signos vitales y con rastros de violencia a la 1:27 de la madrugada de hoy al Centro de Diagnóstico y Tratamiento (CDT) de Santa Isabel.Según el informe del agente José Torres, de la División de Homicidios del Cuerpo de Investigaciones Criminales (CDC) de Ponce, Daisy Colón llegó con su hija al centro asistencial, donde el doctor Ongay solo pudo certificar su muerte.Se hicieron cargo de la investigación el agente Torres y el fiscal Juan Pumarejo, quien ordenó el levantamiento del cadáver y su envío al Negociado de Ciencias Forenses para que una autopsia determine con exactitud las causas del fallecimiento.","Llevan a infanta fallecida a CDT de Santa Isabel","/ley-y-orden/llevan-a-infanta-fallecida-a-cdt-de-santa-isabel/article_d10823f2-6d42-11eb-b139-07646f56870e.html"
